{
  "$schema": "http://json-schema.org/draft-04/schema#",
  "type": "object",
  "title": "webpagetest-run",
  "description": "Web-performance metrics",
  "properties": {
    "appName": {
      "type": "string"
    },
    "channel": {
      "type": "string"
    },
    "version": {
      "type": "string"
    },
    "connection": {
      "type": "string"
    },
    "url": {
      "type": "string"
    },
    "platform": {
      "type": "string",
      "enum": ["desktop", "mobile"]
    },
    "runner": {
      "type": "string"
    },
    "runId": {
      "type": "string"
    },
    "sessionState": {
      "type": "string",
      "enum": ["auth", "noAuth"]
    },
    "metrics": {
      "additionalProperties": {
        "properties": {
          "firstView": {
            "properties": {
              "median": {
                "type": "number"
              },
              "standardDeviation": {
                "type": "number"
              }
            },
            "anyOf": [
              {"required": ["median"]},
              {"required": ["standardDeviation"]}
            ],
            "type": "object"
          }
        },
        "required": ["firstView"],
        "type": "object"
      },
      "type": "object"
    }
  },
  "required": ["appName", "channel", "version", "connection", "url", "platform", "runner", "runId", "sessionState", "metrics"],
  "additionalProperties": false
}
