{
  "appName": "firefox",
  "channel": "release",
  "version": "63.0",
  "connection": "cable",
  "url": "wikipedia.org",
  "platform": "desktop",
  "metrics": {
    "firstPaint": {
      "firstView": {
        "median": 4.2,
        "standardDeviation": 2
      }
    },
    "render": {
      "firstView": {
        "median": 11,
        "standardDeviation": 2
      }
    },
    "visualComplete": {
      "firstView": {
        "median": 10,
        "standardDeviation": 2
      }
    },
    "SpeedIndex": {
      "firstView": {
        "median": 20,
        "standardDeviation": 2
      }
    }
  },
  "runner": "jenkins-prod",
  "runId": "jenkins-wpt/google-123",
  "sessionState": "noAuth"
}
